1;"Refresco do Chaves";"Suco de limão que parece tamarindo e tem gosto de groselia";1.99;BEBIDAS;false;;false
2;"Sanduiche de presunto do Chaves";"Sanduiche de presunto simples, mas feito com muito amor";3.50;PRATOS_PRINCIPAIS;true;2.99;false
3;"Torta de Frango da Dona Florinda";"Torta de frango com recheio cremoso e massa crocante";12.99;PRATOS_PRINCIPAIS;true;10.99;false
4;"Pipoca do Quico";"Balde de pipoca preparado com carinho pelo Quico";4.99;PRATOS_PRINCIPAIS;true;3.99;true
5;"Água de Jamaica";"Água aromatizada com hibisco e toque de açucar";2.50;BEBIDAS;true;2.00;false
6;"Churros do Chaves";"Churros recheado com doce de leite, classico e irresistivel";4.99;SOBREMESAS;true;3.99;true
7;"Tacos de Carnitas";"Tacos recheados com carne tnra";25.90;PRATOS_PRINCIPAIS;false;;true